{
  "$schema": "schema/frame_bundle.schema.json",
  "schema_version": "2.3",
  "width": 48,
  "height": 12,
  "color_mode": "rgb888",
  "frame_encoding": "base64",
  "frames": [
    "/////////////////4AA/////////////4AA/////////////4AA/////////////4AA/////////////4AA/////////////4AA/////////////4AA/////////////4AA/////////////4AA/////////////4AA/////////////4AA/////////////////wAA/wAA/wAAAAAAAAAAAAAAAAAAAAAAAAAAAAAAAAAAAAAAAAAAAAAAAAAAAAAAAAAAAAAAAAAAAAAAAAAAAAAAAAAA/wC0AAAAAAAAAAAAAAAAAAAAAAAAAAAAAAAAAAAAAAAAAAAAAAAAAAAAAAAAAAAAAAAAAAAAAAAAAAAAAIAAAIAAAIAA/////////wAA/wAA/wAAAAAAAAAAAAAAAAAAAAAAAAAAAAAAAAAAAAAAAAAAAAAAAAAAAAAAAAAAAAAAAAAAAAAAAAAAAAAAAAAA/wC0AAAAAAAAAAAAAAAAAAAAAAAAAAAAAAAAAAAAAAAAAAAAAAAAAAAAAAAAAAAAAAAAAAAAAAAAAAAAAIAAAIAAAIAA/////////wAA/wAA/wAAAAAAAAAAAAAAAAAAAAAAAAAAAAAAAAAAAAAAAAAAAAAAAAAAAAAAAAAAAAAAAAAAAAAAAAAAAAAAAAAA/wC0AAAAAAAAAAAAAAAAAAAAAAAAAAAAAAAAAAAAAAAAAAAAAAAAAAAAAAAAAAAAAAAAAAAAAAAAAAAAAIAAAIAAAIAA////AP+AAAAAAAAAAAAAAAAAAAAAAAAAAAAAAAAAAAAAAAAAAAAAAAAAAAAAAAAAAAAAAAAAAAAAAAAAAAAAAAAAAAAAAAAAAAAA/wC0AAAAAAAAAAAAAAAAAAAAAAAAAAAAAAAAAAAAAAAAAAAAAAAAAAAAAAAA////AAAAAAAAAAAAAAAAAAAAAAAAAAAAAP+A////AAAAAAAAAAAAAAAAAAAAAAAAAAAAAAAAAAAAAAAAAAAAAAAAAAAAAAAAAAAAAP8AAP8AAAAAAAAAAAAAAAAAAAAAAAAA/wC0AAAAAAAAAAAAAAAAAAAAAAAAAAAAAAAAAAAAAAAAAAAAAAAAAAAAAAAAAAAA////////AAAAAAAAAAAAAAAAAAAA////////AKD/AKD/AKD/AKD/AKD/AKD/AKD/////////////////////////////////AP8AAP8A////////////////////////////////////////////////////////////////////////////////////////////////////AKD/AKD/AKD/AKD/////////AAAAAAAAAAAAAAAAAAAAAAAAAAAAAAAAAAAAAAAAAAAAAAAAAAAAAAAAAAAAAAAAAAAAAAAAAAAAAAAAAAAAAAAAAAAA/wC0AAAAAAAAAAAAAAAAAAAAAAAAAAAAAAAAAAAAAAAAAAAAAAAAAAAAAAAAAAAA////////AAAAAAAAAAAAAAAAAAAA////AP+AAAD/AAD/AAD/AAAAAAAAAAAAAAAAAAAAAAAAAAAAAAAAAAAAAAAAAAAAAAAAAAAAAAAAAAAAAAAAAAAAAAAAAAAAAAAA/wC0AAAAAAAAAAAAAAAAAAAAAAAAAAAAAAAAAAAAAAAAAAAAAAAAAAAAAAAA////AAAAAAAAAAAAAAAA//8A//8A//8AAP+A////AAD/AP//AP//AAAAAAAAAP//AP//AAAAAAAAAP//AP//AAAAAAAAAP//AP//AAAAAAAAAP//AP//AAAAAAAAAP//AP///wC0AAAAAP//AP//AAAAAAAAAP//AP//AAAAAAAAAP//AP//AAAAAAAAAP//AP//AAAAAAAAAP//AP////8A//8A//8A////////AAD/AP//AP//AAAAAAAAAP//AP//AAAAAAAAAP//AP//AAAAAAAAAP//AP//AAAAAAAAAP//AP//AAAAAAAAAP//AP///wC0AAAAAP//AP//AAAAAAAAAP//AP//AAAAAAAAAP//AP//AAAAAAAAAP//AP//AAAAAAAAAP//AP////8A//8A//8A/////////////////////4AA/////////////4AA/////////////4AA/////////////4AA/////////////4AA/////////////4AA/////////////4AA/////////////4AA/////////////4AA/////////////4AA/////////////4AA////////////",
    "/////////////////4AA/////////////4AA/////////////4AA/////////////4AA/////////////4AA/////////////4AA/////////////4AA/////////////4AA/////////////4AA/////////////4AA/////////////4AA/////////////////wAA/wAA/wAAAAAAAAAAAAAAAAAAAAAAAAAAAAAAAAAAAAAAAAAAAAAAAAAAAAAAAAAAAAAAAAAAAAAAAAAAAAAAAAAA/wC0AAAAAAAAAAAAAAAAAAAAAAAAAAAAAAAAAAAAAAAAAAAAAAAAAAAAAAAAAAAAAAAAAAAAAAAAAAAAAIAAAIAAAIAA/////////wAA/wAA/wAAAAAAAAAAAAAAAAAAAAAAAAAAAAAAAAAAAAAAAAAAAAAAAAAAAAAAAAAAAAAAAAAAAAAAAAAAAAAAAAAA/wC0AAAAAAAAAAAAAAAAAAAAAAAAAAAAAAAAAAAAAAAAAAAAAAAAAAAAAAAAAAAAAAAAAAAAAAAAAAAAAIAAAIAAAIAA/////////wAA/wAA/wAAAAAAAAAAAAAAAAAAAAAAAAAAAAAAAAAAAAAAAAAAAAAAAAAAAAAAAAAAAAAAAAAAAAAAAAAAAAAAAAAA/wC0AAAAAAAAAAAAAAAAAAAAAAAAAAAAAAAAAAAAAAAAAAAAAAAAAAAAAAAAAAAAAAAAAAAAAAAAAAAAAIAAAIAAAIAA////AP+AAAAAAAAAAAAAAAAAAAAAAAAAAAAAAAAAAAAAAAAAAAAAAAAAAAAAAAAAAAAAAAAAAAAAAAAAAAAAAAAAAAAAAAAAAAAA/wC0AAAAAAAAAAAAAAAAAAAAAAAAAAAAAAAAAAAAAAAAAAAAAAAAAAAAAAAA////AAAAAAAAAAAAAAAAAAAAAAAAAAAAAP+A////AAAAAAAAAAAAAAAAAAAAAAAAAAAAAAAAAAAAAAAAAAAAAAAAAAAAAAAAAAAAAAAAAAAAAAAAAAAAAAAAAAAAAAAAAAAA/wC0AAAAAAAAAAAAAAAAAAAAAAAAAAAA/6UA/6UAAAAAAAAAAAAAAAAAAAAAAAAA////////AAAAAAAAAAAAAAAAAAAA////////AKD/AKD/AKD/AKD/AKD/AKD/AKD//////////////////////////////////////////////////////////////////////////////////////////////////6UA/6UA////////////////////////////////////AKD/AKD/AKD/AKD/////////AAAAAAAAAAAAAAAAAAAAAAAAAAAAAAAAAAAAAAAAAAAAAAAAAAAAAAAAAAAAAAAAAAAAAAAAAAAAAAAAAAAAAAAAAAAA/wC0AAAAAAAAAAAAAAAAAAAAAAAAAAAAAAAAAAAAAAAAAAAAAAAAAAAAAAAAAAAA////////AAAAAAAAAAAAAAAAAAAA////AP+AAAD/AAD/AAD/AAAAAAAAAAAAAAAAAAAAAAAAAAAAAAAAAAAAAAAAAAAAAAAAAAAAAAAAAAAAAAAAAAAAAAAAAAAAAAAA/wC0AAAAAAAAAAAAAAAAAAAAAAAAAAAAAAAAAAAAAAAAAAAAAAAAAAAAAAAA////AAAAAAAAAAAAAAAA//8A//8A//8AAP+A////AAD/AAD/AAD//wD//wD/AAAAAAAA/wD//wD/AAAAAAAA/wD//wD/AAAAAAAA/wD//wD/AAAAAAAA/wD//wD/AAAAAAAA/wD//wD/AAAAAAAA/wD//wD/AAAAAAAA/wD//wD/AAAAAAAA/wD//wD/AAAAAAAA/wD//wD/AAAAAAAA/wD//wD///8A////////AAD/AAD/AAD//wD//wD/AAAAAAAA/wD//wD/AAAAAAAA/wD//wD/AAAAAAAA/wD//wD/AAAAAAAA/wD//wD/AAAAAAAA/wD//wD/AAAAAAAA/wD//wD/AAAAAAAA/wD//wD/AAAAAAAA/wD//wD/AAAAAAAA/wD//wD/AAAAAAAA/wD//wD///8A/////////////////////4AA/////////////4AA/////////////4AA/////////////4AA/////////////4AA/////////////4AA/////////////4AA/////////////4AA/////////////4AA/////////////4AA/////////////4AA////////////"
  ],
  "frame_hashes": [
    "450c9315e81eaf389aa2e85734e071729ebcb7ba6b65aa131970b7c360fa569e",
    "5df49aaeb9038feefa9bdb6e5ebd9ad8c5bb5d7b19725afb362f54c1c99ce898"
  ],
  "frame_durations_ms": [
    500,
    500
  ],
  "frames_per_second": 2.0,
  "loop_mode": "loop",
  "codec_hint": "profile_native",
  "metadata": {
    "created_by": "PixelAnimationStudio",
    "compiler_version": "0.1.0",
    "created_at": "2026-07-13T15:06:33.251978+00:00",
    "pattern": "two-frame"
  }
}
