{
  "$schema": "schema/frame_bundle.schema.json",
  "schema_version": "2.3",
  "width": 48,
  "height": 12,
  "color_mode": "rgb888",
  "frame_encoding": "base64",
  "frames": [
    "/////////////////4AA/////////////4AA/////////////4AA/////////////4AA/////////////4AA/////////////4AA/////////////4AA/////////////4AA/////////////4AA/////////////4AA/////////////4AA/////////////////wAA/wAA/wAAAAAAAAAAAAAAAAAAAAAAAAAAAAAAAAAAAAAAAAAAAAAAAAAAAAAAAAAAAAAAAAAAAAAAAAAAAAAAAAAA/wC0AAAAAAAAAAAAAAAAAAAAAAAAAAAAAAAAAAAAAAAAAAAAAAAAAAAAAAAAAAAAAAAAAAAAAAAAAAAAAIAAAIAAAIAA/////////wAA/wAA/wAAAAAAAAAAAAAAAAAAAAAAAAAAAAAAAAAAAAAAAAAAAAAAAAAAAAAAAAAAAAAAAAAAAAAAAAAAAAAAAAAA/wC0AAAAAAAAAAAAAAAAAAAAAAAAAAAAAAAAAAAAAAAAAAAAAAAAAAAAAAAAAAAAAAAAAAAAAAAAAAAAAIAAAIAAAIAA/////////wAA/wAA/wAAAAAAAAAAAAAAAAAAAAAAAAAAAAAAAAAAAAAAAAAAAAAAAAAAAAAAAAAAAAAAAAAAAAAAAAAAAAAAAAAA/wC0AAAAAAAAAAAAAAAAAAAAAAAAAAAAAAAAAAAAAAAAAAAAAAAAAAAAAAAAAAAAAAAAAAAAAAAAAAAAAIAAAIAAAIAA////AP+AAAAAAAAAAAAAAAAAAAAAAAAAAAAAAAAAAAAAAAAAAAAAAAAAAAAAAAAAAAAAAAAAAAAAAAAAAAAAAAAAAAAAAAAAAAAA/wC0AAAAAAAAAAAAAAAAAAAAAAAAAAAAAAAAAAAAAAAAAAAAAAAAAAAAAAAA////AAAAAAAAAAAAAAAAAAAAAAAAAAAAAP+A////AAAAAAAAAAAAAAAAAAAAAAAAAAAAAAAAAAAAAAAAAAAAAAAAAAAAAAAAAAAAAAAAAAAAAAAAAAAAAAAAAAAAAAAAAAAA/wC0AAAAAAAAAAAAAAAAAAAAAAAAAAAAAAAAAAAAAAAAAAAAAAAAAAAAAAAAAAAA////////AAAAAAAAAAAAAAAAAAAA////////AKD/AKD/AKD/AKD/AKD/AKD/AKD/////////////////////////////////////////////////////////////////////////////////////////////////////////////////////////////////////////////AKD/AKD/AKD/AKD/////////AAAAAAAAAAAAAAAAAAAAAAAAAAAAAAAAAAAAAAAAAAAAAAAAAAAAAAAAAAAAAAAAAAAAAAAAAAAAAAAAAAAAAAAAAAAA/wC0AAAAAAAAAAAAAAAAAAAAAAAAAAAAAAAAAAAAAAAAAAAAAAAAAAAAAAAAAAAA////////AAAAAAAAAAAAAAAAAAAA////AP+AAAD/AAD/AAD/AAAAAAAAAAAAAAAAAAAAAAAAAAAAAAAAAAAAAAAAAAAAAAAAAAAAAAAAAAAAAAAAAAAAAAAAAAAAAAAA/wC0AAAAAAAAAAAAAAAAAAAAAAAAAAAAAAAAAAAAAAAAAAAAAAAAAAAAAAAA////AAAAAAAAAAAAAAAA//8A//8A//8AAP+A////AAD/AAD/AAD/AAAAAAAAAAAAAAAAAAAAAAAAAAAAAAAAAAAAAAAAAAAAAAAAAAAAAAAAAAAAAAAAAAAAAAAAAAAAAAAA/wC0AAAAAAAAAAAAAAAAAAAAAAAAAAAAAAAAAAAAAAAAAAAAAAAAAAAAAAAAAAAAAAAAAAAAAAAAAAAA//8A//8A//8A////////AAD/AAD/AAD/AAAAAAAAAAAAAAAAAAAAAAAAAAAAAAAAAAAAAAAAAAAAAAAAAAAAAAAAAAAAAAAAAAAAAAAAAAAAAAAA/wC0AAAAAAAAAAAAAAAAAAAAAAAAAAAAAAAAAAAAAAAAAAAAAAAAAAAAAAAAAAAAAAAAAAAAAAAAAAAA//8A//8A//8A/////////////////////4AA/////////////4AA/////////////4AA/////////////4AA/////////////4AA/////////////4AA/////////////4AA/////////////4AA/////////////4AA/////////////4AA/////////////4AA////////////"
  ],
  "frame_hashes": [
    "3b4c54b77d3d66f6bf91b92fd0a50df591f6d08987f90f7a068581d0eb54e364"
  ],
  "frame_durations_ms": [
    1000
  ],
  "frames_per_second": 1.0,
  "loop_mode": "loop",
  "codec_hint": "profile_native",
  "metadata": {
    "created_by": "PixelAnimationStudio",
    "compiler_version": "0.1.0",
    "created_at": "2026-07-13T15:06:32.033136+00:00",
    "pattern": "test"
  }
}
