{
  "$schema": "schema/frame_bundle.schema.json",
  "schema_version": "2.3",
  "width": 64,
  "height": 16,
  "color_mode": "rgb888",
  "frame_encoding": "base64",
  "frames": [
    "/////////////////4AA/////////////4AA/////////////4AA/////////////4AA/////////////4AA/////////////4AA/////////////4AA/////////////4AA/////////////4AA/////////////4AA/////////////4AA/////////////4AA/////////////4AA/////////////4AA/////////////4AA/////////////////wAA/wAA/wAAAAAAAAAAAAAAAAAAAAAAAAAAAAAAAAAAAAAAAAAAAAAAAAAAAAAAAAAAAAAAAAAAAAAAAAAAAAAAAAAAAAAAAAAAAAAAAAAAAAAAAAAAAAAAAAAA/wC0AAAAAAAAAAAAAAAAAAAAAAAAAAAAAAAAAAAAAAAAAAAAAAAAAAAAAAAAAAAAAAAAAAAAAAAAAAAAAAAAAAAAAAAAAAAAAAAAAAAAAAAAAAAAAIAAAIAAAIAA/////////wAA/wAA/wAAAAAAAAAAAAAAAAAAAAAAAAAAAAAAAAAAAAAAAAAAAAAAAAAAAAAAAAAAAAAAAAAAAAAAAAAAAAAAAAAAAAAAAAAAAAAAAAAAAAAAAAAAAAAAAAAA/wC0AAAAAAAAAAAAAAAAAAAAAAAAAAAAAAAAAAAAAAAAAAAAAAAAAAAAAAAAAAAAAAAAAAAAAAAAAAAAAAAAAAAAAAAAAAAAAAAAAAAAAAAAAAAAAIAAAIAAAIAA/////////wAA/wAA/wAAAAAAAAAAAAAAAAAAAAAAAAAAAAAAAAAAAAAAAAAAAAAAAAAAAAAAAAAAAAAAAAAAAAAAAAAAAAAAAAAAAAAAAAAAAAAAAAAAAAAAAAAAAAAAAAAA/wC0AAAAAAAAAAAAAAAAAAAAAAAAAAAAAAAAAAAAAAAAAAAAAAAAAAAAAAAAAAAAAAAAAAAAAAAAAAAAAAAAAAAAAAAAAAAAAAAAAAAAAAAAAAAAAIAAAIAAAIAA////AP+AAAAAAAAAAAAAAAAAAAAAAAAAAAAAAAAAAAAAAAAAAAAAAAAAAAAAAAAAAAAAAAAAAAAAAAAAAAAAAAAAAAAAAAAAAAAAAAAAAAAAAAAAAAAAAAAAAAAAAAAAAAAA/wC0AAAAAAAAAAAAAAAAAAAAAAAAAAAAAAAAAAAAAAAAAAAAAAAAAAAAAAAAAAAAAAAAAAAAAAAAAAAAAAAAAAAAAAAAAAAAAAAAAAAAAAAAAAAAAAAAAAAAAAAAAP+A////AAAAAAAAAAAAAAAAAAAAAAAAAAAAAAAAAAAAAAAAAAAAAAAAAAAAAAAAAAAAAAAAAAAAAAAAAAAAAAAAAAAAAAAAAAAAAAAAAAAAAAAAAAAAAAAAAAAAAAAAAAAA/wC0AAAAAAAAAAAAAAAAAAAAAAAAAAAAAAAAAAAAAAAAAAAAAAAAAAAAAAAAAAAAAAAAAAAAAAAAAAAAAAAAAAAAAAAAAAAAAAAAAAAAAAAAAAAAAAAAAAAAAAAA////////AAAAAAAAAAAAAAAAAAAAAAAAAAAAAAAAAAAAAAAAAAAAAAAAAAAAAAAAAAAAAAAAAAAAAAAAAAAAAAAAAAAAAAAAAAAAAAAAAAAAAAAAAAAAAAAAAAAAAAAAAAAA/wC0AAAAAAAAAAAAAAAAAAAAAAAAAAAAAAAAAAAAAAAAAAAAAAAAAAAAAAAAAAAAAAAAAAAAAAAAAAAAAAAA////AAAAAAAAAAAAAAAAAAAAAAAAAAAAAAAAAAAA////////AAAAAAAAAAAAAAAAAAAAAAAAAAAAAAAAAAAAAAAAAAAAAAAAAAAAAAAAAAAAAAAAAAAAAAAAAAAAAAAAAP8AAP8AAAAAAAAAAAAAAAAAAAAAAAAAAAAAAAAAAAAA/wC0AAAAAAAAAAAAAAAAAAAAAAAAAAAAAAAAAAAAAAAAAAAAAAAAAAAAAAAAAAAAAAAAAAAAAAAAAAAAAAAAAAAA////////AAAAAAAAAAAAAAAAAAAAAAAAAAAA////AP+AAKD/AKD/AKD/AKD/AKD/AKD/AKD/AKD/AKD/////////////////////////////////////////////AP8AAP8A////////////////////////////////////////////////////////////////////////////////////////////////////////////////////////////////////////AKD/AKD/AKD/AKD/AKD/AKD/AP+A////AAAAAAAAAAAAAAAAAAAAAAAAAAAAAAAAAAAAAAAAAAAAAAAAAAAAAAAAAAAAAAAAAAAAAAAAAAAAAAAAAAAAAAAAAAAAAAAAAAAAAAAAAAAAAAAAAAAAAAAAAAAA/wC0AAAAAAAAAAAAAAAAAAAAAAAAAAAAAAAAAAAAAAAAAAAAAAAAAAAAAAAAAAAAAAAAAAAAAAAAAAAAAAAAAAAA////////AAAAAAAAAAAAAAAAAAAAAAAAAAAA////////AAAAAAAAAAAAAAAAAAAAAAAAAAAAAAAAAAAAAAAAAAAAAAAAAAAAAAAAAAAAAAAAAAAAAAAAAAAAAAAAAAAAAAAAAAAAAAAAAAAAAAAAAAAAAAAAAAAAAAAAAAAA/wC0AAAAAAAAAAAAAAAAAAAAAAAAAAAAAAAAAAAAAAAAAAAAAAAAAAAAAAAAAAAAAAAAAAAAAAAAAAAAAAAA////AAAAAAAAAAAAAAAAAAAAAAAAAAAAAAAAAAAA////////AAAAAAAAAAAAAAAAAAAAAAAAAAAAAAAAAAAAAAAAAAAAAAAAAAAAAAAAAAAAAAAAAAAAAAAAAAAAAAAAAAAAAAAAAAAAAAAAAAAAAAAAAAAAAAAAAAAAAAAAAAAA/wC0AAAAAAAAAAAAAAAAAAAAAAAAAAAAAAAAAAAAAAAAAAAAAAAAAAAAAAAAAAAAAAAAAAAAAAAAAAAAAAAAAAAAAAAAAAAAAAAAAAAAAAAAAAAAAAAAAAAAAAAA////AP+AAAD/AAD/AAD/AAAAAAAAAAAAAAAAAAAAAAAAAAAAAAAAAAAAAAAAAAAAAAAAAAAAAAAAAAAAAAAAAAAAAAAAAAAAAAAAAAAAAAAAAAAAAAAAAAAAAAAAAAAAAAAA/wC0AAAAAAAAAAAAAAAAAAAAAAAAAAAAAAAAAAAAAAAAAAAAAAAAAAAAAAAAAAAAAAAAAAAAAAAAAAAAAAAAAAAAAAAAAAAAAAAAAAAAAAAAAAAA//8A//8A//8AAP+A////AAD/AP//AP//AAAAAAAAAP//AP//AAAAAAAAAP//AP//AAAAAAAAAP//AP//AAAAAAAAAP//AP//AAAAAAAAAP//AP//AAAAAAAAAP//AP//AAAAAAAAAP//AP///wC0AAAAAP//AP//AAAAAAAAAP//AP//AAAAAAAAAP//AP//AAAAAAAAAP//AP//AAAAAAAAAP//AP//AAAAAAAAAP//AP//AAAAAAAAAP//AP////8A//8A//8A////////AAD/AP//AP//AAAAAAAAAP//AP//AAAAAAAAAP//AP//AAAAAAAAAP//AP//AAAAAAAAAP//AP//AAAAAAAAAP//AP//AAAAAAAAAP//AP//AAAAAAAAAP//AP///wC0AAAAAP//AP//AAAAAAAAAP//AP//AAAAAAAAAP//AP//AAAAAAAAAP//AP//AAAAAAAAAP//AP//AAAAAAAAAP//AP//AAAAAAAAAP//AP////8A//8A//8A/////////////////////4AA/////////////4AA/////////////4AA/////////////4AA/////////////4AA/////////////4AA/////////////4AA/////////////4AA/////////////4AA/////////////4AA/////////////4AA/////////////4AA/////////////4AA/////////////4AA/////////////4AA////////////",
    "/////////////////4AA/////////////4AA/////////////4AA/////////////4AA/////////////4AA/////////////4AA/////////////4AA/////////////4AA/////////////4AA/////////////4AA/////////////4AA/////////////4AA/////////////4AA/////////////4AA/////////////4AA/////////////////wAA/wAA/wAAAAAAAAAAAAAAAAAAAAAAAAAAAAAAAAAAAAAAAAAAAAAAAAAAAAAAAAAAAAAAAAAAAAAAAAAAAAAAAAAAAAAAAAAAAAAAAAAAAAAAAAAAAAAAAAAA/wC0AAAAAAAAAAAAAAAAAAAAAAAAAAAAAAAAAAAAAAAAAAAAAAAAAAAAAAAAAAAAAAAAAAAAAAAAAAAAAAAAAAAAAAAAAAAAAAAAAAAAAAAAAAAAAIAAAIAAAIAA/////////wAA/wAA/wAAAAAAAAAAAAAAAAAAAAAAAAAAAAAAAAAAAAAAAAAAAAAAAAAAAAAAAAAAAAAAAAAAAAAAAAAAAAAAAAAAAAAAAAAAAAAAAAAAAAAAAAAAAAAAAAAA/wC0AAAAAAAAAAAAAAAAAAAAAAAAAAAAAAAAAAAAAAAAAAAAAAAAAAAAAAAAAAAAAAAAAAAAAAAAAAAAAAAAAAAAAAAAAAAAAAAAAAAAAAAAAAAAAIAAAIAAAIAA/////////wAA/wAA/wAAAAAAAAAAAAAAAAAAAAAAAAAAAAAAAAAAAAAAAAAAAAAAAAAAAAAAAAAAAAAAAAAAAAAAAAAAAAAAAAAAAAAAAAAAAAAAAAAAAAAAAAAAAAAAAAAA/wC0AAAAAAAAAAAAAAAAAAAAAAAAAAAAAAAAAAAAAAAAAAAAAAAAAAAAAAAAAAAAAAAAAAAAAAAAAAAAAAAAAAAAAAAAAAAAAAAAAAAAAAAAAAAAAIAAAIAAAIAA////AP+AAAAAAAAAAAAAAAAAAAAAAAAAAAAAAAAAAAAAAAAAAAAAAAAAAAAAAAAAAAAAAAAAAAAAAAAAAAAAAAAAAAAAAAAAAAAAAAAAAAAAAAAAAAAAAAAAAAAAAAAAAAAA/wC0AAAAAAAAAAAAAAAAAAAAAAAAAAAAAAAAAAAAAAAAAAAAAAAAAAAAAAAAAAAAAAAAAAAAAAAAAAAAAAAAAAAAAAAAAAAAAAAAAAAAAAAAAAAAAAAAAAAAAAAAAP+A////AAAAAAAAAAAAAAAAAAAAAAAAAAAAAAAAAAAAAAAAAAAAAAAAAAAAAAAAAAAAAAAAAAAAAAAAAAAAAAAAAAAAAAAAAAAAAAAAAAAAAAAAAAAAAAAAAAAAAAAAAAAA/wC0AAAAAAAAAAAAAAAAAAAAAAAAAAAAAAAAAAAAAAAAAAAAAAAAAAAAAAAAAAAAAAAAAAAAAAAAAAAAAAAAAAAAAAAAAAAAAAAAAAAAAAAAAAAAAAAAAAAAAAAA////////AAAAAAAAAAAAAAAAAAAAAAAAAAAAAAAAAAAAAAAAAAAAAAAAAAAAAAAAAAAAAAAAAAAAAAAAAAAAAAAAAAAAAAAAAAAAAAAAAAAAAAAAAAAAAAAAAAAAAAAAAAAA/wC0AAAAAAAAAAAAAAAAAAAAAAAAAAAAAAAAAAAAAAAAAAAAAAAAAAAAAAAAAAAAAAAAAAAAAAAAAAAAAAAA////AAAAAAAAAAAAAAAAAAAAAAAAAAAAAAAAAAAA////////AAAAAAAAAAAAAAAAAAAAAAAAAAAAAAAAAAAAAAAAAAAAAAAAAAAAAAAAAAAAAAAAAAAAAAAAAAAAAAAAAAAAAAAAAAAAAAAAAAAAAAAAAAAAAAAAAAAAAAAAAAAA/wC0AAAAAAAAAAAAAAAAAAAAAAAAAAAAAAAAAAAA/6UA/6UAAAAAAAAAAAAAAAAAAAAAAAAAAAAAAAAAAAAAAAAA////////AAAAAAAAAAAAAAAAAAAAAAAAAAAA////AP+AAKD/AKD/AKD/AKD/AKD/AKD/AKD/AKD/AKD//////////////////////////////////////////////////////////////////////////////////////////////////////////////////////////////////6UA/6UA////////////////////////////////////////////////////AKD/AKD/AKD/AKD/AKD/AKD/AP+A////AAAAAAAAAAAAAAAAAAAAAAAAAAAAAAAAAAAAAAAAAAAAAAAAAAAAAAAAAAAAAAAAAAAAAAAAAAAAAAAAAAAAAAAAAAAAAAAAAAAAAAAAAAAAAAAAAAAAAAAAAAAA/wC0AAAAAAAAAAAAAAAAAAAAAAAAAAAAAAAAAAAAAAAAAAAAAAAAAAAAAAAAAAAAAAAAAAAAAAAAAAAAAAAAAAAA////////AAAAAAAAAAAAAAAAAAAAAAAAAAAA////////AAAAAAAAAAAAAAAAAAAAAAAAAAAAAAAAAAAAAAAAAAAAAAAAAAAAAAAAAAAAAAAAAAAAAAAAAAAAAAAAAAAAAAAAAAAAAAAAAAAAAAAAAAAAAAAAAAAAAAAAAAAA/wC0AAAAAAAAAAAAAAAAAAAAAAAAAAAAAAAAAAAAAAAAAAAAAAAAAAAAAAAAAAAAAAAAAAAAAAAAAAAAAAAA////AAAAAAAAAAAAAAAAAAAAAAAAAAAAAAAAAAAA////////AAAAAAAAAAAAAAAAAAAAAAAAAAAAAAAAAAAAAAAAAAAAAAAAAAAAAAAAAAAAAAAAAAAAAAAAAAAAAAAAAAAAAAAAAAAAAAAAAAAAAAAAAAAAAAAAAAAAAAAAAAAA/wC0AAAAAAAAAAAAAAAAAAAAAAAAAAAAAAAAAAAAAAAAAAAAAAAAAAAAAAAAAAAAAAAAAAAAAAAAAAAAAAAAAAAAAAAAAAAAAAAAAAAAAAAAAAAAAAAAAAAAAAAA////AP+AAAD/AAD/AAD/AAAAAAAAAAAAAAAAAAAAAAAAAAAAAAAAAAAAAAAAAAAAAAAAAAAAAAAAAAAAAAAAAAAAAAAAAAAAAAAAAAAAAAAAAAAAAAAAAAAAAAAAAAAAAAAA/wC0AAAAAAAAAAAAAAAAAAAAAAAAAAAAAAAAAAAAAAAAAAAAAAAAAAAAAAAAAAAAAAAAAAAAAAAAAAAAAAAAAAAAAAAAAAAAAAAAAAAAAAAAAAAA//8A//8A//8AAP+A////AAD/AAD/AAD//wD//wD/AAAAAAAA/wD//wD/AAAAAAAA/wD//wD/AAAAAAAA/wD//wD/AAAAAAAA/wD//wD/AAAAAAAA/wD//wD/AAAAAAAA/wD//wD/AAAAAAAA/wD//wD/AAAAAAAA/wD//wD/AAAAAAAA/wD//wD/AAAAAAAA/wD//wD/AAAAAAAA/wD//wD/AAAAAAAA/wD//wD/AAAAAAAA/wD//wD/AAAAAAAA/wD//wD///8A////////AAD/AAD/AAD//wD//wD/AAAAAAAA/wD//wD/AAAAAAAA/wD//wD/AAAAAAAA/wD//wD/AAAAAAAA/wD//wD/AAAAAAAA/wD//wD/AAAAAAAA/wD//wD/AAAAAAAA/wD//wD/AAAAAAAA/wD//wD/AAAAAAAA/wD//wD/AAAAAAAA/wD//wD/AAAAAAAA/wD//wD/AAAAAAAA/wD//wD/AAAAAAAA/wD//wD/AAAAAAAA/wD//wD///8A/////////////////////4AA/////////////4AA/////////////4AA/////////////4AA/////////////4AA/////////////4AA/////////////4AA/////////////4AA/////////////4AA/////////////4AA/////////////4AA/////////////4AA/////////////4AA/////////////4AA/////////////4AA////////////"
  ],
  "frame_hashes": [
    "87e6e0237d762c79ad1f92dfaaed763db2bb4325a4794836b8abc6dbf21f3828",
    "73d40fd2baa3edaf0559790f487277f93e29a9b73a69b78e1dc9132899cdd02f"
  ],
  "frame_durations_ms": [
    500,
    500
  ],
  "frames_per_second": 2.0,
  "loop_mode": "loop",
  "codec_hint": "profile_native",
  "metadata": {
    "created_by": "PixelAnimationStudio",
    "compiler_version": "0.1.0",
    "created_at": "2026-07-13T19:17:21.011472+00:00",
    "pattern": "two-frame"
  }
}
